{
 "$schema": "https://json-schema.org/draft/2020-12/schema",
 "additionalProperties": false,
 "properties": {
  "facts": {
   "additionalProperties": {
    "additionalProperties": false,
    "properties": {
     "note": {
      "type": "string"
     },
     "tag": {
      "pattern": "^(OBSERVED|DERIVED|PREDICTED|SIMULATED|SYNTHETIC)(/(OBSERVED|DERIVED|PREDICTED|SIMULATED|SYNTHETIC))*$",
      "type": "string"
     },
     "unit": {
      "type": "string"
     },
     "value": {}
    },
    "required": [
     "value",
     "unit",
     "tag"
    ],
    "type": "object"
   },
   "type": "object"
  },
  "generated_at": {
   "type": "string"
  },
  "schema_version": {
   "const": "v1"
  },
  "tags": {
   "additionalProperties": {
    "pattern": "^(OBSERVED|DERIVED|PREDICTED|SIMULATED|SYNTHETIC)(/(OBSERVED|DERIVED|PREDICTED|SIMULATED|SYNTHETIC))*$",
    "type": "string"
   },
   "minProperties": 1,
   "type": "object"
  }
 },
 "required": [
  "schema_version",
  "generated_at",
  "tags",
  "facts"
 ],
 "title": "Facts",
 "type": "object"
}
