{"facts":{"credit_cost_at_0_5":{"note":"test split n=250","tag":"PREDICTED/OBSERVED","unit":"cost units per applicant","value":1.092},"credit_cost_optimal":{"note":"","tag":"PREDICTED/OBSERVED","unit":"cost units per applicant","value":0.576},"credit_test_auc":{"note":"","tag":"PREDICTED","unit":"AUC","value":0.736457},"credit_threshold_optimal":{"note":"empirical grid optimum on test","tag":"PREDICTED/OBSERVED","unit":"p_bad","value":0.1},"credit_threshold_theory":{"note":"c_fp/(c_fp+c_fn) = 1/6","tag":"DERIVED","unit":"p_bad","value":0.1666666667},"ishigami_s1":{"note":"","tag":"DERIVED","unit":"index","value":0.313905191148},"ishigami_st3":{"note":"","tag":"DERIVED","unit":"index","value":0.243683664062},"mc_mean_npv":{"note":"","tag":"SYNTHETIC","unit":"USD M","value":11.08657993},"mc_p_loss":{"note":"","tag":"SYNTHETIC","unit":"share","value":0.3798},"nsw_benchmark_se":{"note":"","tag":"DERIVED","unit":"USD","value":671.0},"nsw_benchmark_usd":{"note":"randomized difference in means","tag":"OBSERVED/DERIVED","unit":"USD 1978","value":1794.34},"nsw_gap_ipw_usd":{"note":"","tag":"DERIVED","unit":"USD","value":-512.84},"nsw_gap_naive_usd":{"note":"","tag":"DERIVED","unit":"USD","value":-16999.12},"nsw_gap_ols_usd":{"note":"","tag":"DERIVED","unit":"USD","value":-1727.06},"nsw_gap_ra_usd":{"note":"","tag":"DERIVED","unit":"USD","value":-1054.0},"nsw_psid_ipw_usd":{"note":"","tag":"OBSERVED/DERIVED","unit":"USD 1978","value":1281.5},"nsw_psid_naive_usd":{"note":"treated vs PSID, no adjustment","tag":"OBSERVED/DERIVED","unit":"USD 1978","value":-15204.78},"nsw_psid_ra_usd":{"note":"","tag":"OBSERVED/DERIVED","unit":"USD 1978","value":740.35},"pareto_points":{"note":"","tag":"DERIVED","unit":"points","value":21}},"generated_at":"2026-10-11T00:00:00Z","schema_version":"v1","tags":{"facts":"DERIVED"}}