{"facts":{"credit_cost_at_0_5":{"note":"test split n=250","tag":"PREDICTED/OBSERVED","unit":"cost units per applicant","value":1.092},"credit_cost_optimal":{"note":"","tag":"PREDICTED/OBSERVED","unit":"cost units per applicant","value":0.576},"credit_test_auc":{"note":"","tag":"PREDICTED","unit":"AUC","value":0.736457},"credit_threshold_optimal":{"note":"empirical grid optimum on test","tag":"PREDICTED/OBSERVED","unit":"p_bad","value":0.1},"credit_threshold_theory":{"note":"c_fp/(c_fp+c_fn) = 1/6","tag":"DERIVED","unit":"p_bad","value":0.1666666667},"ishigami_s1":{"note":"","tag":"DERIVED","unit":"index","value":0.313905191148},"ishigami_st3":{"note":"","tag":"DERIVED","unit":"index","value":0.243683664062},"mc_mean_n100000":{"note":"mean NPV over the 100000-trial stream","tag":"SYNTHETIC","unit":"USD M","value":10.95339316},"mc_mean_npv":{"note":"","tag":"SYNTHETIC","unit":"USD M","value":11.08657993},"mc_median_payback_year":{"note":"BUILD NOW; median among futures that pay back within 8 years","tag":"SYNTHETIC","unit":"years from today","value":6.195425},"mc_median_payback_year_delay_one_year":{"note":"","tag":"SYNTHETIC","unit":"years from today","value":6.78289},"mc_median_payback_year_phased":{"note":"","tag":"SYNTHETIC","unit":"years from today","value":5.959289},"mc_n":{"note":"","tag":"SYNTHETIC","unit":"futures","value":20000},"mc_p_loss":{"note":"","tag":"SYNTHETIC","unit":"share","value":0.3798},"mc_payback_share_8y":{"note":"BUILD NOW; discounted payback within 8 calendar years","tag":"SYNTHETIC","unit":"share","value":0.6202},"mc_payback_share_8y_delay_one_year":{"note":"window cuts the last project year","tag":"SYNTHETIC","unit":"share","value":0.45765},"mc_payback_share_8y_phased":{"note":"","tag":"SYNTHETIC","unit":"share","value":0.7011},"mc_se":{"note":"standard error of the mean NPV, n = 20000","tag":"SYNTHETIC","unit":"USD M","value":0.22905794},"nsw_benchmark_se":{"note":"","tag":"DERIVED","unit":"USD","value":671.0},"nsw_benchmark_usd":{"note":"randomized difference in means","tag":"OBSERVED/DERIVED","unit":"USD 1978","value":1794.34},"nsw_gap_ipw_usd":{"note":"","tag":"DERIVED","unit":"USD","value":-512.84},"nsw_gap_naive_usd":{"note":"","tag":"DERIVED","unit":"USD","value":-16999.12},"nsw_gap_ols_usd":{"note":"","tag":"DERIVED","unit":"USD","value":-1727.06},"nsw_gap_ra_usd":{"note":"","tag":"DERIVED","unit":"USD","value":-1054.0},"nsw_ipw_ess_controls":{"note":"of 2490 PSID controls","tag":"DERIVED","unit":"effective controls","value":11.9},"nsw_psid_ipw_usd":{"note":"","tag":"OBSERVED/DERIVED","unit":"USD 1978","value":1281.5},"nsw_psid_naive_usd":{"note":"treated vs PSID, no adjustment","tag":"OBSERVED/DERIVED","unit":"USD 1978","value":-15204.78},"nsw_psid_ra_usd":{"note":"","tag":"OBSERVED/DERIVED","unit":"USD 1978","value":740.35},"pareto_points":{"note":"","tag":"DERIVED","unit":"points","value":21},"parity_vectors_total":{"note":"entries in every vectors array incl. per-decision vectors, plus m02 seed_vectors and m01 cases","tag":"DERIVED","unit":"vectors","value":68},"validation_passed":{"note":"pipeline checks passed (validation.json)","tag":"DERIVED","unit":"checks","value":71},"validation_total":{"note":"","tag":"DERIVED","unit":"checks","value":71}},"generated_at":"2026-10-11T00:00:00Z","schema_version":"v1","tags":{"facts":"DERIVED"}}